{
  "artifact_checks": [],
  "attempt_id": "eval-K02-scvi-count-input-b--generic_rag--r1--attempt-1",
  "experiment_manifest_digest": "77d5498983fcddf0a9868e282f6180a620ae057b8d1ccad460b7e67325ec4a05",
  "failure_evidence": [],
  "lane": "generic_rag",
  "latency_ms": 5066.584582993528,
  "provider_calls": [
    {
      "call_id": "call-01",
      "input_tokens": 2005,
      "latency_ms": 2623.9436250034487,
      "messages_ref": "calls/call-01.request.json",
      "messages_sha256": "e62465695d37146afdc3aea8673cf1b3a485992bfebade492b8d4d984ab68cbb",
      "model": "deepseek-v4-pro",
      "model_revision": "deepseek-v4-pro",
      "output_tokens": 345,
      "parameters": {
        "max_tokens": 1800,
        "seed": null,
        "temperature": 0,
        "timeout_seconds": 60
      },
      "provider": "api.deepseek.com",
      "purpose": "routing",
      "status": "completed",
      "usage_source": "provider_reported"
    },
    {
      "call_id": "call-02",
      "input_tokens": 2224,
      "latency_ms": 2171.699124999577,
      "messages_ref": "calls/call-02.request.json",
      "messages_sha256": "8074d211e15a1735dcf54b921fa5dfbe73dc33e3a2cdf4446c1d65746fbaf334",
      "model": "deepseek-v4-pro",
      "model_revision": "deepseek-v4-pro",
      "output_tokens": 275,
      "parameters": {
        "max_tokens": 2400,
        "seed": null,
        "temperature": 0,
        "timeout_seconds": 60
      },
      "provider": "api.deepseek.com",
      "purpose": "synthesis",
      "status": "completed",
      "usage_source": "provider_reported"
    }
  ],
  "retrieval_requests": [
    {
      "backend": "engine.hybrid_retrieval.HybridRetrievalService",
      "effective_request": {
        "canonical_tasks": [
          "batch_integration"
        ],
        "claim_types": [
          "input_requirement",
          "caveat"
        ],
        "enable_dense": false,
        "enable_sparse": true,
        "include_catalog": false,
        "nonblocking_dense": true,
        "query": "scVI batch integration low-dimensional representation input requirements log1p normalized counts raw counts",
        "source_types": [],
        "tool_names": [
          "scVI"
        ],
        "top_k": 5,
        "use_contract_gate": false,
        "use_governance_rerank": false,
        "use_kg": false,
        "use_scientific_evidence": false
      },
      "excluded_ids": [],
      "final_context_ref": "final_context.json",
      "final_context_sha256": "2f8f165bf827789c0cd05b4258ff6f5622dd2cafb052780b2b54562db284e949",
      "final_context_tokens": null,
      "path": "search_evidence",
      "request_id": "retrieval-01",
      "returned_ids": [],
      "snapshot_digest": "d2201c59d3fb00c4164479276389377b4225573625839cab62e3c1b9ca858497",
      "trace_span_id": "span_22a21476ba9a4081a900903d7ee5123c"
    }
  ],
  "run_id": "eval-K02-scvi-count-input-b--generic_rag--r1",
  "scenario_digest": "ae992996d0bf5729c7ab244203b9d59ced403ca63752c1296428101e986ca027",
  "schema_version": "sckg-runtime-receipt-v1",
  "seed": {
    "actual": null,
    "provider_seed_supported": null,
    "requested": null,
    "scheduling_seed": 20260921
  },
  "session_id": "eval-K02-scvi-count-input-b--generic_rag--r1",
  "status": "completed"
}
