{
  "artifact_checks": [],
  "attempt_id": "eval-K05-soupx-auto-clusters-b--legacy_kg--r0--attempt-1",
  "experiment_manifest_digest": "77d5498983fcddf0a9868e282f6180a620ae057b8d1ccad460b7e67325ec4a05",
  "failure_evidence": [],
  "lane": "legacy_kg",
  "latency_ms": 5820.230999990599,
  "provider_calls": [
    {
      "call_id": "call-01",
      "input_tokens": 1994,
      "latency_ms": 2166.6928750055376,
      "messages_ref": "calls/call-01.request.json",
      "messages_sha256": "c7be57966affb9166c16907f105c456796979cc4bb356d9f1be245b542d8a722",
      "model": "deepseek-v4-pro",
      "model_revision": "deepseek-v4-pro",
      "output_tokens": 314,
      "parameters": {
        "max_tokens": 1800,
        "seed": null,
        "temperature": 0,
        "timeout_seconds": 60
      },
      "provider": "api.deepseek.com",
      "purpose": "routing",
      "status": "completed",
      "usage_source": "provider_reported"
    },
    {
      "call_id": "call-02",
      "input_tokens": 2178,
      "latency_ms": 2167.364124994492,
      "messages_ref": "calls/call-02.request.json",
      "messages_sha256": "a89f40173ea0cf4838723985cac257ee47137845ecfad44d4b42e02e426691e4",
      "model": "deepseek-v4-pro",
      "model_revision": "deepseek-v4-pro",
      "output_tokens": 221,
      "parameters": {
        "max_tokens": 2400,
        "seed": null,
        "temperature": 0,
        "timeout_seconds": 60
      },
      "provider": "api.deepseek.com",
      "purpose": "synthesis",
      "status": "completed",
      "usage_source": "provider_reported"
    }
  ],
  "retrieval_requests": [
    {
      "backend": "engine.hybrid_retrieval.HybridRetrievalService",
      "effective_request": {
        "canonical_tasks": [
          "ambient_rna_removal"
        ],
        "claim_types": [
          "input_requirement",
          "failure_mode"
        ],
        "enable_dense": false,
        "enable_sparse": true,
        "include_catalog": false,
        "nonblocking_dense": true,
        "query": "SoupX automatic contamination fraction estimation requirements clusters and droplet UMI counts",
        "source_types": [],
        "tool_names": [
          "SoupX"
        ],
        "top_k": 5,
        "use_contract_gate": false,
        "use_governance_rerank": false,
        "use_kg": true,
        "use_scientific_evidence": true
      },
      "excluded_ids": [],
      "final_context_ref": "final_context.json",
      "final_context_sha256": "4e607d4bf21feea10f5ae67d77cb8b6f8503f6cd371ff0e495cefdfa2dab37db",
      "final_context_tokens": null,
      "path": "search_evidence",
      "request_id": "retrieval-01",
      "returned_ids": [
        "publication:CAND_PUB_SoupX_5218c8e163d7"
      ],
      "snapshot_digest": "0451e9d35fac87e7c4160c52bfebead5c3391d36d38341f45abe62df3dc53a4d",
      "trace_span_id": "span_1417d8d25e1645d29d3bce145bb6fe56"
    }
  ],
  "run_id": "eval-K05-soupx-auto-clusters-b--legacy_kg--r0",
  "scenario_digest": "d7d9a2fc9f159f61d9cd004390da663491075c20b160ffca0cc29a32b6758243",
  "schema_version": "sckg-runtime-receipt-v1",
  "seed": {
    "actual": null,
    "provider_seed_supported": null,
    "requested": null,
    "scheduling_seed": 20260921
  },
  "session_id": "eval-K05-soupx-auto-clusters-b--legacy_kg--r0",
  "status": "completed"
}
