{
  "artifact_checks": [],
  "attempt_id": "eval-K10-cellrank-strength-a--generic_rag--r1--attempt-1",
  "experiment_manifest_digest": "6246c2c7feef4e9cbae3940421022e8d7625219b4cd7193c73caeb377c6c8582",
  "failure_evidence": [],
  "lane": "generic_rag",
  "latency_ms": 5218.390583002474,
  "provider_calls": [
    {
      "call_id": "call-01",
      "input_tokens": 2008,
      "latency_ms": 2535.3652500052704,
      "messages_ref": "calls/call-01.request.json",
      "messages_sha256": "2e512aa22e7ff1f8dda4216617b35da35cc895d20a99c9f99aefd7c7a58742ee",
      "model": "deepseek-v4-pro",
      "model_revision": "deepseek-v4-pro",
      "output_tokens": 332,
      "parameters": {
        "max_tokens": 1800,
        "seed": null,
        "temperature": 0,
        "timeout_seconds": 60
      },
      "provider": "api.deepseek.com",
      "purpose": "routing",
      "status": "completed",
      "usage_source": "provider_reported"
    },
    {
      "call_id": "call-02",
      "input_tokens": 2211,
      "latency_ms": 2206.4024999999674,
      "messages_ref": "calls/call-02.request.json",
      "messages_sha256": "b03e30f3beb99ff157c1f772b2969dd7eabeff7f59b6fefbb325b4fc2658dd63",
      "model": "deepseek-v4-pro",
      "model_revision": "deepseek-v4-pro",
      "output_tokens": 271,
      "parameters": {
        "max_tokens": 2400,
        "seed": null,
        "temperature": 0,
        "timeout_seconds": 60
      },
      "provider": "api.deepseek.com",
      "purpose": "synthesis",
      "status": "completed",
      "usage_source": "provider_reported"
    }
  ],
  "retrieval_requests": [
    {
      "backend": "engine.hybrid_retrieval.HybridRetrievalService",
      "effective_request": {
        "canonical_tasks": [
          "trajectory_inference"
        ],
        "claim_types": [
          "caveat",
          "mechanism",
          "benchmark"
        ],
        "enable_dense": false,
        "enable_sparse": true,
        "include_catalog": false,
        "nonblocking_dense": true,
        "query": "CellRank lineage fate probability associated genes candidate driver genes evidence strength independent intervention",
        "source_types": [],
        "tool_names": [
          "CellRank"
        ],
        "top_k": 5,
        "use_contract_gate": false,
        "use_governance_rerank": false,
        "use_kg": false,
        "use_scientific_evidence": false
      },
      "excluded_ids": [],
      "final_context_ref": "final_context.json",
      "final_context_sha256": "b5b40c4621d45abedb5f746f5f21ac5066d3b25190d059afe8342645ffd82730",
      "final_context_tokens": null,
      "path": "search_evidence",
      "request_id": "retrieval-01",
      "returned_ids": [
        "sourcev2:cb52594c3943e6225471",
        "sourcev2:2c180c928bbb466c022e",
        "sourcev2:a8d85cd1bbc3f7d2f13e",
        "sourcev2:19399e1c7e79e73de76e",
        "sourcev2:5c697e3a6217d12989c2"
      ],
      "snapshot_digest": "d2201c59d3fb00c4164479276389377b4225573625839cab62e3c1b9ca858497",
      "trace_span_id": "span_0a1cbd09369041b59f10755e23d4b2cb"
    }
  ],
  "run_id": "eval-K10-cellrank-strength-a--generic_rag--r1",
  "scenario_digest": "05ceae3bb01a4cdc09c4a63dd4a23e3f6ec5e0a2de1ab38d71952644666f8a48",
  "schema_version": "sckg-runtime-receipt-v1",
  "seed": {
    "actual": null,
    "provider_seed_supported": null,
    "requested": null,
    "scheduling_seed": 20260921
  },
  "session_id": "eval-K10-cellrank-strength-a--generic_rag--r1",
  "status": "completed"
}
