{
  "artifact_checks": [],
  "attempt_id": "eval-K06-soupx-adjust-order-b--llm_only--r0--attempt-1",
  "experiment_manifest_digest": "6246c2c7feef4e9cbae3940421022e8d7625219b4cd7193c73caeb377c6c8582",
  "failure_evidence": [],
  "lane": "llm_only",
  "latency_ms": 5001.717291001114,
  "provider_calls": [
    {
      "call_id": "call-01",
      "input_tokens": 1992,
      "latency_ms": 3367.471541001578,
      "messages_ref": "calls/call-01.request.json",
      "messages_sha256": "b17734228c2667a57929fc3e1ee505150d2ccb481cc94d0d89377d9837e01014",
      "model": "deepseek-v4-pro",
      "model_revision": "deepseek-v4-pro",
      "output_tokens": 449,
      "parameters": {
        "max_tokens": 1800,
        "seed": null,
        "temperature": 0,
        "timeout_seconds": 60
      },
      "provider": "api.deepseek.com",
      "purpose": "routing",
      "status": "completed",
      "usage_source": "provider_reported"
    }
  ],
  "retrieval_requests": [],
  "run_id": "eval-K06-soupx-adjust-order-b--llm_only--r0",
  "scenario_digest": "36caa06d9f3231dc509f1b47f23256d4dd2c70778db1df3359ace930a028d46a",
  "schema_version": "sckg-runtime-receipt-v1",
  "seed": {
    "actual": null,
    "provider_seed_supported": null,
    "requested": null,
    "scheduling_seed": 20260921
  },
  "session_id": "eval-K06-soupx-adjust-order-b--llm_only--r0",
  "status": "completed"
}
