{
  "artifact_checks": [],
  "attempt_id": "eval-K05-soupx-auto-clusters-a--llm_only--r0--attempt-1",
  "experiment_manifest_digest": "6246c2c7feef4e9cbae3940421022e8d7625219b4cd7193c73caeb377c6c8582",
  "failure_evidence": [],
  "lane": "llm_only",
  "latency_ms": 1384.5675000047777,
  "provider_calls": [
    {
      "call_id": "call-01",
      "input_tokens": null,
      "latency_ms": 464.4474579981761,
      "messages_ref": "calls/call-01.request.json",
      "messages_sha256": "e10b6b5f6b3e2bdf38572362845b9f8b70f542d0f8ebb66c26c0d5ae41f3cec8",
      "model": "deepseek-v4-pro",
      "model_revision": null,
      "output_tokens": null,
      "parameters": {
        "max_tokens": 1800,
        "seed": null,
        "temperature": 0,
        "timeout_seconds": 60
      },
      "provider": "api.deepseek.com",
      "purpose": "routing",
      "status": "failed",
      "usage_source": "unavailable"
    },
    {
      "call_id": "call-02",
      "input_tokens": null,
      "latency_ms": 415.7304169930285,
      "messages_ref": "calls/call-02.request.json",
      "messages_sha256": "d814ed372264f2b0796ca903ae1e23f5c9bef21c3a7f3b866352682c59d0721e",
      "model": "deepseek-v4-pro",
      "model_revision": null,
      "output_tokens": null,
      "parameters": {
        "max_tokens": 2400,
        "seed": null,
        "temperature": 0,
        "timeout_seconds": 60
      },
      "provider": "api.deepseek.com",
      "purpose": "synthesis",
      "status": "failed",
      "usage_source": "unavailable"
    }
  ],
  "retrieval_requests": [],
  "run_id": "eval-K05-soupx-auto-clusters-a--llm_only--r0",
  "scenario_digest": "9525bc41e5b7addc5caef5de11dd62defa61ed8ec7b7ac1aaee00818fab97696",
  "schema_version": "sckg-runtime-receipt-v1",
  "seed": {
    "actual": null,
    "provider_seed_supported": null,
    "requested": null,
    "scheduling_seed": 20260921
  },
  "session_id": "eval-K05-soupx-auto-clusters-a--llm_only--r0",
  "status": "completed"
}
