{
  "artifact_checks": [],
  "attempt_id": "eval-K05-soupx-auto-clusters-b--scientific_kg--r2--attempt-1",
  "experiment_manifest_digest": "77d5498983fcddf0a9868e282f6180a620ae057b8d1ccad460b7e67325ec4a05",
  "failure_evidence": [],
  "lane": "scientific_kg",
  "latency_ms": 10286.003041997901,
  "provider_calls": [
    {
      "call_id": "call-01",
      "input_tokens": 1994,
      "latency_ms": 2932.729374995688,
      "messages_ref": "calls/call-01.request.json",
      "messages_sha256": "c7be57966affb9166c16907f105c456796979cc4bb356d9f1be245b542d8a722",
      "model": "deepseek-v4-pro",
      "model_revision": "deepseek-v4-pro",
      "output_tokens": 348,
      "parameters": {
        "max_tokens": 1800,
        "seed": null,
        "temperature": 0,
        "timeout_seconds": 60
      },
      "provider": "api.deepseek.com",
      "purpose": "routing",
      "status": "completed",
      "usage_source": "provider_reported"
    },
    {
      "call_id": "call-02",
      "input_tokens": 11728,
      "latency_ms": 5585.634999995818,
      "messages_ref": "calls/call-02.request.json",
      "messages_sha256": "fab08056206b1b7112c10be9edace1284c4736ba5de020ef5a60e9aae25e31a8",
      "model": "deepseek-v4-pro",
      "model_revision": "deepseek-v4-pro",
      "output_tokens": 744,
      "parameters": {
        "max_tokens": 2400,
        "seed": null,
        "temperature": 0,
        "timeout_seconds": 60
      },
      "provider": "api.deepseek.com",
      "purpose": "synthesis",
      "status": "completed",
      "usage_source": "provider_reported"
    },
    {
      "call_id": "call-03",
      "input_tokens": 4870,
      "latency_ms": 1503.232000002754,
      "messages_ref": "calls/call-03.request.json",
      "messages_sha256": "7a9055e6e6ae38620dd7504400f7d0f5f0746b7cf49818e73adc85a80e0e6bb7",
      "model": "deepseek-v4-pro",
      "model_revision": "deepseek-v4-pro",
      "output_tokens": 128,
      "parameters": {
        "max_tokens": 900,
        "seed": null,
        "temperature": 0,
        "timeout_seconds": 45
      },
      "provider": "api.deepseek.com",
      "purpose": "support_check",
      "status": "completed",
      "usage_source": "provider_reported"
    }
  ],
  "retrieval_requests": [
    {
      "backend": "engine.approved_scientific_kg.ApprovedScientificKG",
      "effective_request": {
        "canonical_tasks": [
          "ambient_rna_removal"
        ],
        "claim_types": [
          "input_requirement",
          "failure_mode"
        ],
        "enable_dense": false,
        "enable_sparse": true,
        "include_catalog": false,
        "nonblocking_dense": true,
        "query": "SoupX automatic contamination fraction estimation requirements: does it need clusters? What inputs are required for autoEstCont?",
        "source_types": [],
        "tool_names": [
          "SoupX"
        ],
        "top_k": 5,
        "use_contract_gate": false,
        "use_governance_rerank": false,
        "use_kg": true,
        "use_scientific_evidence": true
      },
      "excluded_ids": [],
      "final_context_ref": "final_context.json",
      "final_context_sha256": "f77d698baa9fff5d8511f4094cf1cb33fc0066e0b488c0395b3fd20d1fa6fa22",
      "final_context_tokens": null,
      "path": "search_evidence",
      "request_id": "retrieval-01",
      "returned_ids": [
        "approved-v2:65c70b5fe704faf81b609987",
        "approved-v2:b770cdedd7b21d78446d3baf",
        "approved-v2:08fdd20a3f2cdfadad2d7934",
        "approved-v2:012c433a23db5c95fb4736e3",
        "approved-v2:ddafadb3746e31212d1e0ecc"
      ],
      "snapshot_digest": "06b6772dac4c17c75e8a52b01d40574ecd992702d5228e7634fa8e20f61638c4",
      "trace_span_id": "span_2dd4c50f68bd42df97b831736a76ad7a"
    }
  ],
  "run_id": "eval-K05-soupx-auto-clusters-b--scientific_kg--r2",
  "scenario_digest": "d7d9a2fc9f159f61d9cd004390da663491075c20b160ffca0cc29a32b6758243",
  "schema_version": "sckg-runtime-receipt-v1",
  "seed": {
    "actual": null,
    "provider_seed_supported": null,
    "requested": null,
    "scheduling_seed": 20260921
  },
  "session_id": "eval-K05-soupx-auto-clusters-b--scientific_kg--r2",
  "status": "completed"
}
