{
  "artifact_checks": [],
  "attempt_id": "eval-K09-mofaplus-alignment-b--llm_only--r0--attempt-1",
  "experiment_manifest_digest": "6246c2c7feef4e9cbae3940421022e8d7625219b4cd7193c73caeb377c6c8582",
  "failure_evidence": [],
  "lane": "llm_only",
  "latency_ms": 6914.104125011363,
  "provider_calls": [
    {
      "call_id": "call-01",
      "input_tokens": 2012,
      "latency_ms": 3038.624249995337,
      "messages_ref": "calls/call-01.request.json",
      "messages_sha256": "f9b38840633ac6d0cb3727667f0fe23c9f44d43734152952d79a9f38baa6c6f4",
      "model": "deepseek-v4-pro",
      "model_revision": "deepseek-v4-pro",
      "output_tokens": 367,
      "parameters": {
        "max_tokens": 1800,
        "seed": null,
        "temperature": 0,
        "timeout_seconds": 60
      },
      "provider": "api.deepseek.com",
      "purpose": "routing",
      "status": "completed",
      "usage_source": "provider_reported"
    },
    {
      "call_id": "call-02",
      "input_tokens": 2352,
      "latency_ms": 3432.438458010438,
      "messages_ref": "calls/call-02.request.json",
      "messages_sha256": "e6e5f1f11e715d9247c912985b6c519869aec7c76bffb5f02203137ef9390bdb",
      "model": "deepseek-v4-pro",
      "model_revision": "deepseek-v4-pro",
      "output_tokens": 387,
      "parameters": {
        "max_tokens": 2400,
        "seed": null,
        "temperature": 0,
        "timeout_seconds": 60
      },
      "provider": "api.deepseek.com",
      "purpose": "synthesis",
      "status": "completed",
      "usage_source": "provider_reported"
    }
  ],
  "retrieval_requests": [],
  "run_id": "eval-K09-mofaplus-alignment-b--llm_only--r0",
  "scenario_digest": "cac12eed99d3f381c8ed98c26d03711380defb39ef968ee6a2c6d9fd1c46cfda",
  "schema_version": "sckg-runtime-receipt-v1",
  "seed": {
    "actual": null,
    "provider_seed_supported": null,
    "requested": null,
    "scheduling_seed": 20260921
  },
  "session_id": "eval-K09-mofaplus-alignment-b--llm_only--r0",
  "status": "completed"
}
