{
  "artifact_checks": [],
  "attempt_id": "eval-K06-soupx-adjust-order-a--generic_rag--r0--attempt-1",
  "experiment_manifest_digest": "6246c2c7feef4e9cbae3940421022e8d7625219b4cd7193c73caeb377c6c8582",
  "failure_evidence": [],
  "lane": "generic_rag",
  "latency_ms": 1624.8857919999864,
  "provider_calls": [
    {
      "call_id": "call-01",
      "input_tokens": null,
      "latency_ms": 712.7055829914752,
      "messages_ref": "calls/call-01.request.json",
      "messages_sha256": "ff19d2121fec817c153ce514e5ad17f7cea62b5439ad779432267509a0be818d",
      "model": "deepseek-v4-pro",
      "model_revision": null,
      "output_tokens": null,
      "parameters": {
        "max_tokens": 1800,
        "seed": null,
        "temperature": 0,
        "timeout_seconds": 60
      },
      "provider": "api.deepseek.com",
      "purpose": "routing",
      "status": "failed",
      "usage_source": "unavailable"
    },
    {
      "call_id": "call-02",
      "input_tokens": null,
      "latency_ms": 404.98383301019203,
      "messages_ref": "calls/call-02.request.json",
      "messages_sha256": "140358eed76021930c97b9e754b07cc838a0a17d372a27955083127b272b077b",
      "model": "deepseek-v4-pro",
      "model_revision": null,
      "output_tokens": null,
      "parameters": {
        "max_tokens": 2400,
        "seed": null,
        "temperature": 0,
        "timeout_seconds": 60
      },
      "provider": "api.deepseek.com",
      "purpose": "synthesis",
      "status": "failed",
      "usage_source": "unavailable"
    }
  ],
  "retrieval_requests": [
    {
      "backend": "engine.hybrid_retrieval.HybridRetrievalService",
      "effective_request": {
        "canonical_tasks": [
          "ambient_rna_removal"
        ],
        "claim_types": [
          "mechanism",
          "general"
        ],
        "enable_dense": false,
        "enable_sparse": true,
        "include_catalog": false,
        "nonblocking_dense": true,
        "query": "我准备调用 SoupX adjustCounts。按当前状态能否直接校正，还是必须先完成别的步骤？不要执行。\n\n已提供的条件（未提供的值不作推断）：\ncontamination_fraction=estimated for this channel\ncount_matrix=present\nRetrieval hints: canonical task: ambient rna removal; claim: method mechanism principle; claim: method documentation",
        "source_types": [],
        "tool_names": [],
        "top_k": 12,
        "use_contract_gate": false,
        "use_governance_rerank": false,
        "use_kg": false,
        "use_scientific_evidence": false
      },
      "excluded_ids": [],
      "final_context_ref": "final_context.json",
      "final_context_sha256": "24b866be232cbcada96d07fb792f2f14e3ffa778839f50652a5fb67f2ef337fc",
      "final_context_tokens": null,
      "path": "search_evidence",
      "request_id": "retrieval-01",
      "returned_ids": [
        "publication:CAND_PUB_SoupX_5218c8e163d7"
      ],
      "snapshot_digest": "d2201c59d3fb00c4164479276389377b4225573625839cab62e3c1b9ca858497",
      "trace_span_id": "span_16f84d34a44b41d496a055641295393f"
    }
  ],
  "run_id": "eval-K06-soupx-adjust-order-a--generic_rag--r0",
  "scenario_digest": "e34c537359b33709291fcfa0ce1ce8660dd08447c614c0f5e1ca20f2bcca6af5",
  "schema_version": "sckg-runtime-receipt-v1",
  "seed": {
    "actual": null,
    "provider_seed_supported": null,
    "requested": null,
    "scheduling_seed": 20260921
  },
  "session_id": "eval-K06-soupx-adjust-order-a--generic_rag--r0",
  "status": "completed"
}
