{
  "artifact_checks": [],
  "attempt_id": "dev-K01-hvg-input-a--generic_rag--targeted-r0--attempt-1",
  "experiment_manifest_digest": "0c8f749ec06f7395d45f8669b39e3efe7462a3a4b331f03348f5066371695090",
  "failure_evidence": [],
  "lane": "generic_rag",
  "latency_ms": 8340.735874997335,
  "provider_calls": [
    {
      "call_id": "call-01",
      "input_tokens": 2036,
      "latency_ms": 4720.159832999343,
      "messages_ref": "calls/call-01.request.json",
      "messages_sha256": "f07c6f52c645dbabe62c016a8bd53cf914657f7031ad52f71ec1610c1bd74580",
      "model": "deepseek-v4-pro",
      "model_revision": "deepseek-v4-pro",
      "output_tokens": 616,
      "parameters": {
        "max_tokens": 1800,
        "seed": null,
        "temperature": 0,
        "timeout_seconds": 60
      },
      "provider": "api.deepseek.com",
      "purpose": "routing",
      "status": "completed",
      "usage_source": "provider_reported"
    },
    {
      "call_id": "call-02",
      "input_tokens": 2923,
      "latency_ms": 3400.0349580019247,
      "messages_ref": "calls/call-02.request.json",
      "messages_sha256": "80ee1e9aec331f4d9e6a6e149757d1beadfa72bdc129e73e790237b5dfec7cdf",
      "model": "deepseek-v4-pro",
      "model_revision": "deepseek-v4-pro",
      "output_tokens": 348,
      "parameters": {
        "max_tokens": 2400,
        "seed": null,
        "temperature": 0,
        "timeout_seconds": 60
      },
      "provider": "api.deepseek.com",
      "purpose": "synthesis",
      "status": "completed",
      "usage_source": "provider_reported"
    }
  ],
  "retrieval_requests": [
    {
      "backend": "engine.hybrid_retrieval.HybridRetrievalService",
      "effective_request": {
        "canonical_tasks": [
          "scanpy_core_workflow"
        ],
        "claim_types": [
          "input_requirement",
          "parameter",
          "caveat"
        ],
        "enable_dense": false,
        "enable_sparse": true,
        "include_catalog": false,
        "nonblocking_dense": true,
        "query": "Scanpy highly variable genes selection flavor seurat_v3 input requirements raw integer counts matrix applicability conditions next steps",
        "source_types": [],
        "tool_names": [
          "Scanpy"
        ],
        "top_k": 5,
        "use_contract_gate": false,
        "use_governance_rerank": false,
        "use_kg": false,
        "use_scientific_evidence": false
      },
      "excluded_ids": [],
      "final_context_ref": "final_context.json",
      "final_context_sha256": "bce18643d09ed77273a6ff81d02870a8fe51acbe16e210f1fd24e597777c4c9b",
      "final_context_tokens": null,
      "path": "search_evidence",
      "request_id": "retrieval-01",
      "returned_ids": [
        "scanpy-authoritative-span:hvg.flavor_input:1.11.2",
        "gold-span:scanpy:hvg-default-flavor:1.11.2",
        "scanpy-authoritative-span:hvg.output:1.11.2",
        "scanpy-authoritative-span:leiden.input:1.11.2",
        "scanpy-authoritative-span:pca.input:1.11.2"
      ],
      "snapshot_digest": "d2201c59d3fb00c4164479276389377b4225573625839cab62e3c1b9ca858497",
      "trace_span_id": "span_274cb78ea2484a0eaf1ac03a23697021"
    }
  ],
  "run_id": "dev-K01-hvg-input-a--generic_rag--targeted-r0",
  "scenario_digest": "24a7647760f7f23b579413a18c82750f62712df7671b74d9d611df58cbb418ba",
  "schema_version": "sckg-runtime-receipt-v1",
  "seed": {
    "actual": null,
    "provider_seed_supported": null,
    "requested": null,
    "scheduling_seed": 2026092102
  },
  "session_id": "dev-K01-hvg-input-a--generic_rag--targeted-r0",
  "status": "completed"
}
