{
  "artifact_checks": [],
  "attempt_id": "eval-K04-scrublet-reduction-a--legacy_kg--r2--attempt-1",
  "experiment_manifest_digest": "77d5498983fcddf0a9868e282f6180a620ae057b8d1ccad460b7e67325ec4a05",
  "failure_evidence": [],
  "lane": "legacy_kg",
  "latency_ms": 1821.626417004154,
  "provider_calls": [],
  "retrieval_requests": [
    {
      "backend": "engine.hybrid_retrieval.HybridRetrievalService",
      "effective_request": {
        "canonical_tasks": [
          "doublet_detection"
        ],
        "claim_types": [
          "parameter"
        ],
        "enable_dense": false,
        "enable_sparse": true,
        "include_catalog": false,
        "nonblocking_dense": true,
        "query": "在 Scrublet 0.2.3 的 scrub_doublets 中，当前参数组合会使用哪种降维路径？只解释参数语义，不执行。\n\n已提供的条件（未提供的值不作推断）：\nmean_center=true\nnormalize_variance=true\nversion=Scrublet 0.2.3\nRetrieval hints: canonical task: doublet detection; explicit tool: Scrublet; claim: parameter default threshold legal range",
        "source_types": [],
        "tool_names": [
          "Scrublet"
        ],
        "top_k": 12,
        "use_contract_gate": false,
        "use_governance_rerank": false,
        "use_kg": true,
        "use_scientific_evidence": true
      },
      "excluded_ids": [],
      "final_context_ref": "final_context.json",
      "final_context_sha256": "fdb3d397ef382ed2ea534a4b1ef8486f2ecd7847d639cb1f656702081246fbae",
      "final_context_tokens": null,
      "path": "search_evidence",
      "request_id": "retrieval-01",
      "returned_ids": [
        "sourcev2:111374ebeb154e8b9052",
        "sourcev2:312d84f6dc861f930d2f",
        "sourcev2:4b9ca6e3078f53c70723",
        "sourcev2:765dd15eb33e24dd1929",
        "sourcev2:34293e6cd90eaf3a763b",
        "sourcev2:44ceb08cf5823218079e",
        "sourcev2:8e7d7ee794237a2e0df0",
        "sourcev2:4c0788a81994b1579751",
        "sourcev2:33a2377c84a3bf67b16c",
        "sourcev2:e30ca1127e97cb259f69",
        "sourcev2:aa49e2c0f4d4a1150688",
        "sourcev2:0b42fac22bbbab37f893"
      ],
      "snapshot_digest": "0451e9d35fac87e7c4160c52bfebead5c3391d36d38341f45abe62df3dc53a4d",
      "trace_span_id": "span_8b4d4a31db2a470d93baa180aca8b246"
    }
  ],
  "run_id": "eval-K04-scrublet-reduction-a--legacy_kg--r2",
  "scenario_digest": "e1ab1ef576561cd1e2df5e1e616f290333d5f164e0e5ae00f972936e1c242d57",
  "schema_version": "sckg-runtime-receipt-v1",
  "seed": {
    "actual": null,
    "provider_seed_supported": null,
    "requested": null,
    "scheduling_seed": 20260921
  },
  "session_id": "eval-K04-scrublet-reduction-a--legacy_kg--r2",
  "status": "completed"
}
