{
  "artifact_checks": [],
  "attempt_id": "eval-K12-umap-strength-b--scientific_kg--r1--attempt-1",
  "experiment_manifest_digest": "77d5498983fcddf0a9868e282f6180a620ae057b8d1ccad460b7e67325ec4a05",
  "failure_evidence": [],
  "lane": "scientific_kg",
  "latency_ms": 313.01487499149516,
  "provider_calls": [],
  "retrieval_requests": [
    {
      "backend": "engine.approved_scientific_kg.ApprovedScientificKG",
      "effective_request": {
        "canonical_tasks": [
          "quality_control"
        ],
        "claim_types": [
          "mechanism",
          "general"
        ],
        "enable_dense": false,
        "enable_sparse": true,
        "include_catalog": false,
        "nonblocking_dense": true,
        "query": "Scanpy 1.11.2 的 UMAP 图在给定 min_dist 后更紧凑。下面拟写的解释是否在文档支持范围内？不要执行。\n\n已提供的条件（未提供的值不作推断）：\nmin_dist=0.05\nproposed_conclusion=The clumps prove discrete biological cell types\nRetrieval hints: canonical task: quality control; explicit tool: Scanpy; claim: method mechanism principle; claim: method documentation",
        "source_types": [],
        "tool_names": [
          "Scanpy"
        ],
        "top_k": 12,
        "use_contract_gate": false,
        "use_governance_rerank": false,
        "use_kg": true,
        "use_scientific_evidence": true
      },
      "excluded_ids": [],
      "final_context_ref": "final_context.json",
      "final_context_sha256": "6576201b159fa87d109bf25406dbc590d2c71e966ea571bc1c29f700d626df38",
      "final_context_tokens": null,
      "path": "search_evidence",
      "request_id": "retrieval-01",
      "returned_ids": [
        "approved-v2:55bf4428bddcb9c12ce7ca23",
        "approved-v2:d1bd9b38a8bb5a3858624ccb",
        "approved-v2:ff4dbf88dfe5daaf44698209",
        "approved-v2:2c67a8ed5a72f2877cdf65c1"
      ],
      "snapshot_digest": "06b6772dac4c17c75e8a52b01d40574ecd992702d5228e7634fa8e20f61638c4",
      "trace_span_id": "span_ce189cc9a1974f74ba0890c44fdf8ce8"
    }
  ],
  "run_id": "eval-K12-umap-strength-b--scientific_kg--r1",
  "scenario_digest": "3621548585d2f47750a63d97ca04dc4d7d0b470e8dfa70256b5bea5bf9eb1337",
  "schema_version": "sckg-runtime-receipt-v1",
  "seed": {
    "actual": null,
    "provider_seed_supported": null,
    "requested": null,
    "scheduling_seed": 20260921
  },
  "session_id": "eval-K12-umap-strength-b--scientific_kg--r1",
  "status": "completed"
}
