{
  "artifact_checks": [],
  "attempt_id": "eval-W02--scientific_kg--r1--attempt-1",
  "experiment_manifest_digest": "6246c2c7feef4e9cbae3940421022e8d7625219b4cd7193c73caeb377c6c8582",
  "failure_evidence": [],
  "lane": "scientific_kg",
  "latency_ms": 3109.8323749902193,
  "provider_calls": [
    {
      "call_id": "call-01",
      "input_tokens": 474,
      "latency_ms": 2795.653332999791,
      "messages_ref": "calls/call-01.request.json",
      "messages_sha256": "c58caad78d09485361cf390c986c742180c3833a6c42bf26de9cf230597fafb6",
      "model": "deepseek-v4-pro",
      "model_revision": "deepseek-v4-pro",
      "output_tokens": 275,
      "parameters": {
        "max_tokens": 1200,
        "seed": null,
        "temperature": 0,
        "timeout_seconds": 60
      },
      "provider": "api.deepseek.com",
      "purpose": "synthesis",
      "status": "completed",
      "usage_source": "provider_reported"
    }
  ],
  "retrieval_requests": [],
  "run_id": "eval-W02--scientific_kg--r1",
  "scenario_digest": "bdbfdfeb1a27a43bb2b5eeb2fff018df8a14af4e5ff9ff81e5efdda02d7e670a",
  "schema_version": "sckg-runtime-receipt-v1",
  "seed": {
    "actual": null,
    "provider_seed_supported": null,
    "requested": null,
    "scheduling_seed": 20260921
  },
  "session_id": "eval-W02--scientific_kg--r1",
  "status": "completed"
}
