{
  "artifact_checks": [],
  "attempt_id": "eval-K04-scrublet-reduction-b--scientific_kg--r1--attempt-1",
  "experiment_manifest_digest": "6246c2c7feef4e9cbae3940421022e8d7625219b4cd7193c73caeb377c6c8582",
  "failure_evidence": [],
  "lane": "scientific_kg",
  "latency_ms": 1410.8471249928698,
  "provider_calls": [
    {
      "call_id": "call-01",
      "input_tokens": null,
      "latency_ms": 472.50324999913573,
      "messages_ref": "calls/call-01.request.json",
      "messages_sha256": "2775c25c7a0ac86536402dc66bf7925da2f20f6992095985404e78bf8fa548c9",
      "model": "deepseek-v4-pro",
      "model_revision": null,
      "output_tokens": null,
      "parameters": {
        "max_tokens": 1800,
        "seed": null,
        "temperature": 0,
        "timeout_seconds": 60
      },
      "provider": "api.deepseek.com",
      "purpose": "routing",
      "status": "failed",
      "usage_source": "unavailable"
    },
    {
      "call_id": "call-02",
      "input_tokens": null,
      "latency_ms": 411.07979099615477,
      "messages_ref": "calls/call-02.request.json",
      "messages_sha256": "5ad70777773f2d26dc102a6ae340b85006464220a1a8897b269644b76401237f",
      "model": "deepseek-v4-pro",
      "model_revision": null,
      "output_tokens": null,
      "parameters": {
        "max_tokens": 2400,
        "seed": null,
        "temperature": 0,
        "timeout_seconds": 60
      },
      "provider": "api.deepseek.com",
      "purpose": "synthesis",
      "status": "failed",
      "usage_source": "unavailable"
    }
  ],
  "retrieval_requests": [
    {
      "backend": "engine.approved_scientific_kg.ApprovedScientificKG",
      "effective_request": {
        "canonical_tasks": [
          "doublet_detection"
        ],
        "claim_types": [
          "parameter"
        ],
        "enable_dense": false,
        "enable_sparse": true,
        "include_catalog": false,
        "nonblocking_dense": true,
        "query": "在 Scrublet 0.2.3 的 scrub_doublets 中，当前参数组合会使用哪种降维路径？只解释参数语义，不执行。\n\n已提供的条件（未提供的值不作推断）：\nmean_center=false\nnormalize_variance=true\nversion=Scrublet 0.2.3\nRetrieval hints: canonical task: doublet detection; explicit tool: Scrublet; claim: parameter default threshold legal range",
        "source_types": [],
        "tool_names": [
          "Scrublet"
        ],
        "top_k": 12,
        "use_contract_gate": false,
        "use_governance_rerank": false,
        "use_kg": true,
        "use_scientific_evidence": true
      },
      "excluded_ids": [],
      "final_context_ref": "final_context.json",
      "final_context_sha256": "080bbead267723f05d9eea9abd6ba3ecf1bed698cc42fbb8b68fe46956b23c2f",
      "final_context_tokens": null,
      "path": "search_evidence",
      "request_id": "retrieval-01",
      "returned_ids": [
        "approved-v2:33b79d95d2ed4d53a8a1f1db",
        "approved-v2:613b47186a5ad5ce45f0ad89",
        "approved-v2:d099979382db9fb359c5b3be",
        "approved-v2:0e67b4bc0f524fc9fafd330b",
        "approved-v2:b9001a79a44c71c55645bda8",
        "approved-v2:f6cef4018759450c958ab6f4",
        "approved-v2:7a7b1c264085fd73359b1715",
        "approved-v2:2c86d620e994dd85e8b6cea1",
        "approved-v2:586b49b6171571fbb87b4e90",
        "approved-v2:6e5681dfa99ed1cc3045b4d0",
        "approved-v2:b9ea2c2d9bc3e35594bd20e1",
        "approved-v2:cc18b9a204b7c51f6a973672"
      ],
      "snapshot_digest": "06b6772dac4c17c75e8a52b01d40574ecd992702d5228e7634fa8e20f61638c4",
      "trace_span_id": "span_d734bb2fb3f749d39fd31119d67ddbc5"
    }
  ],
  "run_id": "eval-K04-scrublet-reduction-b--scientific_kg--r1",
  "scenario_digest": "1c9ed6fa87fa9d131d81ab040a67dd52642ae96d13044fe66e0a4b8aa985b617",
  "schema_version": "sckg-runtime-receipt-v1",
  "seed": {
    "actual": null,
    "provider_seed_supported": null,
    "requested": null,
    "scheduling_seed": 20260921
  },
  "session_id": "eval-K04-scrublet-reduction-b--scientific_kg--r1",
  "status": "completed"
}
